{
    "bgm": [
        {
            "loop": "loop"
        }
    ],
    "imagesBehind": [
        {
            "image": "1",
            "parallax": 0.6000000238418579,
            "round": 2
        },
        {
            "image": "2",
            "parallax": 0.6000000238418579,
            "round": 3
        },
        {
            "image": "3",
            "parallax": 0.6000000238418579,
            "round": 4
        },
        {
            "image": "4",
            "parallax": 0.6000000238418579,
            "round": 5
        },
        {
            "image": "0.6",
            "parallax": 0.6000000238418579
        },
        {
            "image": "1.0",
            "parallax": 1.0
        }
    ],
    "entities": {
        "h_ground": 30,
        "w_bounds": 640
    },
    "camera": {
        "w": 1280,
        "h": 960
    }
}
