{
    "bgm": [
        {
            "intro": "intro",
            "loop": "loop"
        },
        {
            "intro": "intro2",
            "loop": "loop2"
        }
    ],
    "imagesBehind": [
        {
            "image": "1.0_2",
            "parallax": 1.0
        },
        {
            "image": "1.0",
            "parallax": 1.0,
            "round": 1
        },
        {
            "image": "1.0_2a",
            "parallax": 1.0,
            "round": 2
        },
        {
            "image": "1.0_3a",
            "parallax": 1.0,
            "round": 3
        }
    ],
    "entities": {
        "h_ground": 30,
        "w_bounds": 640
    },
    "camera": {
        "w": 1280,
        "h": 960
    }
}
